{
  "schema_version": 1,
  "manifest_id": "manifest-1",
  "run_id": "20260518-141522-a3f9b2c1",
  "task_card_ref": ".mimir/runs/20260518-141522-a3f9b2c1/task_card.json",
  "candidates": [
    {
      "schema_version": 1,
      "path": "src/auth/session.ts",
      "ranges": [
        { "start": 40, "end": 140 }
      ],
      "candidate_kind": "symbol_slice",
      "reason_code": "failing_test_reference",
      "score": 12.8,
      "features": {
        "direct_task_match": 0.7,
        "symbol_reference_match": 1.0,
        "failing_test_reference": 1.0
      },
      "estimated_tokens": 3100,
      "discovered_by": ["rg", "ast"],
      "source_hash": "b1c2d3e4f5a6b7c8d9e0f1a2b3c4d5e6f7a8b9c0d1e2f3a4b5c6d7e8f9a0b1c2"
    }
  ],
  "stages_run": ["high_recall_scan", "structural_expansion"],
  "stage_latency_ms": {
    "high_recall_scan": 84,
    "structural_expansion": 191
  },
  "elapsed_ms": 275,
  "candidate_count_pre_dedup": 7,
  "candidate_count_post_dedup": 5,
  "created_at": "2026-05-18T14:15:21Z"
}
